県北,ひろの水産会館ウニーク,ヒロノスイサンカイカンウニーク,https://goo.gl/maps/yAu6jE61FDMQ5Zer7,028-7914,九戸郡洋野町種市第22地割133-11,0194-65-5916,http://www.town.hirono.iwate.jp/docs/2015031000019/,,,観光
県央,盛岡市遺跡の学び館,モリオカシイセキノマナビカン,https://goo.gl/maps/vrZzTK5xzgvCoBZy6,020-0866,盛岡市本宮字荒屋13-1,019-635-6600,https://www.city.morioka.iwate.jp/kankou/kankou/1037106/rekishi/1009437/1009438.html,,,観光
沿岸,ホテルマルエ,ホテルマルエ,https://goo.gl/maps/65TFz8aaSJVd3Q9K9,026-0025,釜石市大渡町2-1-10,0193-24-3911,https://www.marue.info/,,,宿泊
県南,世界遺産の隠れ宿　果実の森,セカイイサンノカクレヤド　カジツノモリ,https://goo.gl/maps/tn8gkw3E1kiqkBrq6,021-0041,一関市赤萩字笹谷393-6,0191-34-6600,https://www.kajitsunomori-iwate.jp/,,,宿泊
沿岸,大舟旅館,オオフネリョカン,https://goo.gl/maps/RjNb9D74hsK6K8FE8,029-2204,陸前高田市気仙町要谷156-11,0192-55-3622,,,,宿泊
県南,えさし夢プラザ,エサシユメプラザ,https://goo.gl/maps/FvtzKf9BFuqjoUaE6,023-1104,奥州市江刺豊田町3-1-27江刺バスセンター内,0197-31-1611,http://yumeplaza.jp/,,令和3年8月9日、現在の場所に新装オープンしました。観光土産品の販売をはじめ、サークル団体の展示やバス案内を年中無休で行っています。,観光
県南,Zプラザアテルイ,ゼットプラザアテルイ,https://goo.gl/maps/XfKapyFA7CZ3VEMU8,023-0816,奥州市水沢西町1-1,0197-22-7800,https://twitter.com/ZplazaAterui,,元旦を除き年中無休で営業しています。奥州市をはじめ岩手県内の土産品や工芸品をはじめ、新鮮な野菜等の販売や食堂の営業を行っています。（大型駐車場完備、公衆トイレ併設）,観光
県南,北上パークホテル,キタカミパークホテル,https://goo.gl/maps/rWRnVE7qxn4CLW946,024-0061,北上市大通り2-2-11,0197-65-2323,https://www.kitakamiparkhotel.com/,,,宿泊
